{"job_uuid":"ed42aa74-a012-4bfe-a4ae-15d2edfeb7d3","product_key":"52223bdb-e4cc-497a-8ef4-555e8149d3a5","retailer_id":125,"retailer_name":"iTunes","created_at":"2017-12-24T07:51:04.393Z","updated_at":"2017-12-27T07:51:04.057Z","product_id":"1161504043","name":"That’s What I Like","image_url_retailer":"http://is2.mzstatic.com/image/thumb/Music62/v4/40/98/ed/4098edc3-1ae9-4da7-4778-b9d3b8b2a846/075679904119.jpg/600x600bb-85.jpg","deeplink_url":"https://itunes.apple.com/us/album/thats-what-i-like/1161503945?i=1161504043&uo=2","product_type":["Music","Track"],"price":1.29,"searchable_metadata":[{"name":"copyright","value":"℗ 2016 Atlantic Recording Corporation for the United States and WEA International Inc. for the world outside of the United States. A Warner Music Group Company"},{"name":"genre","value":"Pop"},{"name":"preview_url","value":"https://audio-ssl.itunes.apple.com/apple-assets-us-std-000001/AudioPreview71/v4/ca/7f/28/ca7f2818-514a-5a6f-ac63-bd420da38a0c/mzaf_3303110486375225949.plus.aac.p.m4a"},{"name":"release_date","value":"2016-11-18T00:00:00-07:00"},{"name":"album","value":"24K Magic"},{"name":"album_url","value":"https://itunes.apple.com/us/album/24k-magic/1161503945?uo=2"},{"name":"artist","value":"Bruno Mars"},{"name":"artist_url","value":"https://itunes.apple.com/us/artist/bruno-mars/278873078?uo=2"}],"id":"125:1161504043","start_time":"2017-12-24T07:51:04.393Z","end_time":"2067-12-27T07:51:04.057Z","expiration":"2067-12-27T07:51:04.057Z","typed_id":"prd:125:1161504043","typed_prereq_id":"prd:0","typed_scoring_id":"prd:125:1161504043","launch":true,"active":true,"matching_rules":"{\"rules\":[]}","image_url_thumbnail":"https://d34iyr7lamo4bp.cloudfront.net/125:1161504043/thumbnail.png","image_url_small":"https://d34iyr7lamo4bp.cloudfront.net/125:1161504043/small.png","image_url_large":"https://d34iyr7lamo4bp.cloudfront.net/125:1161504043/large.png","always_nearby":true,"non_searchable_metadata":{"im:name":"{\"label\":\"That’s What I Like\"}","im:image":"[{\"label\":\"http://is2.mzstatic.com/image/thumb/Music62/v4/40/98/ed/4098edc3-1ae9-4da7-4778-b9d3b8b2a846/075679904119.jpg/55x55bb-85.jpg\",\"attributes\":{\"height\":\"55\"}},{\"label\":\"http://is3.mzstatic.com/image/thumb/Music62/v4/40/98/ed/4098edc3-1ae9-4da7-4778-b9d3b8b2a846/075679904119.jpg/60x60bb-85.jpg\",\"attributes\":{\"height\":\"60\"}},{\"label\":\"http://is3.mzstatic.com/image/thumb/Music62/v4/40/98/ed/4098edc3-1ae9-4da7-4778-b9d3b8b2a846/075679904119.jpg/170x170bb-85.jpg\",\"attributes\":{\"height\":\"170\"}}]","im:collection":"{\"im:name\":{\"label\":\"24K Magic\"},\"link\":{\"attributes\":{\"rel\":\"alternate\",\"type\":\"text/html\",\"href\":\"https://itunes.apple.com/us/album/24k-magic/1161503945?uo=2\"}},\"im:contentType\":{\"im:contentType\":{\"attributes\":{\"term\":\"Album\",\"label\":\"Album\"}},\"attributes\":{\"term\":\"Music\",\"label\":\"Music\"}}}","im:price":"{\"label\":\"$1.29\",\"attributes\":{\"amount\":\"1.29000\",\"currency\":\"USD\"}}","im:contentType":"{\"im:contentType\":{\"attributes\":{\"term\":\"Track\",\"label\":\"Track\"}},\"attributes\":{\"term\":\"Music\",\"label\":\"Music\"}}","rights":"{\"label\":\"℗ 2016 Atlantic Recording Corporation for the United States and WEA International Inc. for the world outside of the United States. A Warner Music Group Company\"}","title":"{\"label\":\"That’s What I Like - Bruno Mars\"}","link":"[{\"attributes\":{\"rel\":\"alternate\",\"type\":\"text/html\",\"href\":\"https://itunes.apple.com/us/album/thats-what-i-like/1161503945?i=1161504043&uo=2\"}},{\"im:duration\":{\"label\":\"30000\"},\"attributes\":{\"title\":\"Preview\",\"rel\":\"enclosure\",\"type\":\"audio/x-m4a\",\"href\":\"https://audio-ssl.itunes.apple.com/apple-assets-us-std-000001/AudioPreview71/v4/ca/7f/28/ca7f2818-514a-5a6f-ac63-bd420da38a0c/mzaf_3303110486375225949.plus.aac.p.m4a\",\"im:assetType\":\"preview\"}}]","id":"{\"label\":\"https://itunes.apple.com/us/album/thats-what-i-like/1161503945?i=1161504043&uo=2\",\"attributes\":{\"im:id\":\"1161504043\"}}","im:artist":"{\"label\":\"Bruno Mars\",\"attributes\":{\"href\":\"https://itunes.apple.com/us/artist/bruno-mars/278873078?uo=2\"}}","category":"{\"attributes\":{\"im:id\":\"14\",\"term\":\"Pop\",\"scheme\":\"https://itunes.apple.com/us/genre/music-pop/id14?uo=2\",\"label\":\"Pop\"}}","im:releaseDate":"{\"label\":\"2016-11-18T00:00:00-07:00\",\"attributes\":{\"label\":\"November 18, 2016\"}}"}}
